{
  "schema_version": "0.1.0",
  "run_id": "RUN-OFS003-PILOT-002",
  "monitor_id": "MON-HPCI-CENTERS-001",
  "evaluated_at": "2026-08-23T19:03:43.486329Z",
  "profile_coverage_status": "incomplete",
  "expected": {
    "registry_id": "HPCI-COMPUTE-PROVIDERS-001",
    "center_count": 15,
    "profile_max_age_days": 90,
    "date_only_timezone_grace_days": 1,
    "required_profile_status": "accepted",
    "complete_field_states": [
      "not-applicable",
      "verified"
    ]
  },
  "observed": {
    "profile_count": 15,
    "field_evidence_complete_count": 0,
    "accepted_current_count": 0,
    "profiles": [
      {
        "center_id": "CENTER-AIST-IHF",
        "profile_status": "provisional",
        "proposal_status": "provisional",
        "decision_outcome": "provisional",
        "decision_ref": "decisions/RUN-OFS003-PILOT-002/PRP-CTR-213203.json",
        "profile_age_days": 0,
        "field_evidence_complete": false,
        "accepted_current": false
      },
      {
        "center_id": "CENTER-HOKKAIDO-IIC",
        "profile_status": "provisional",
        "proposal_status": "provisional",
        "decision_outcome": "provisional",
        "decision_ref": "decisions/RUN-OFS003-PILOT-002/PRP-CTR-281041.json",
        "profile_age_days": 0,
        "field_evidence_complete": false,
        "accepted_current": false
      },
      {
        "center_id": "CENTER-ISM-CSST",
        "profile_status": "provisional",
        "proposal_status": "provisional",
        "decision_outcome": "provisional",
        "decision_ref": "decisions/RUN-OFS003-PILOT-002/PRP-CTR-157540.json",
        "profile_age_days": 0,
        "field_evidence_complete": false,
        "accepted_current": false
      },
      {
        "center_id": "CENTER-JAMSTEC-CEIST",
        "profile_status": "provisional",
        "proposal_status": "provisional",
        "decision_outcome": "provisional",
        "decision_ref": "decisions/RUN-OFS003-PILOT-002/PRP-CTR-250436.json",
        "profile_age_days": 0,
        "field_evidence_complete": false,
        "accepted_current": false
      },
      {
        "center_id": "CENTER-JCAHPC",
        "profile_status": "provisional",
        "proposal_status": "provisional",
        "decision_outcome": "provisional",
        "decision_ref": "decisions/RUN-OFS003-PILOT-002/PRP-CTR-236877.json",
        "profile_age_days": 0,
        "field_evidence_complete": false,
        "accepted_current": false
      },
      {
        "center_id": "CENTER-KYOTO-ACCMS",
        "profile_status": "provisional",
        "proposal_status": "provisional",
        "decision_outcome": "provisional",
        "decision_ref": "decisions/RUN-OFS003-PILOT-002/PRP-CTR-729669.json",
        "profile_age_days": 0,
        "field_evidence_complete": false,
        "accepted_current": false
      },
      {
        "center_id": "CENTER-KYUSHU-RIIT",
        "profile_status": "provisional",
        "proposal_status": "provisional",
        "decision_outcome": "provisional",
        "decision_ref": "decisions/RUN-OFS003-PILOT-002/PRP-CTR-166347.json",
        "profile_age_days": 0,
        "field_evidence_complete": false,
        "accepted_current": false
      },
      {
        "center_id": "CENTER-NAGOYA-ITC",
        "profile_status": "provisional",
        "proposal_status": "provisional",
        "decision_outcome": "provisional",
        "decision_ref": "decisions/RUN-OFS003-PILOT-002/PRP-CTR-352034.json",
        "profile_age_days": 0,
        "field_evidence_complete": false,
        "accepted_current": false
      },
      {
        "center_id": "CENTER-OSAKA-D3",
        "profile_status": "provisional",
        "proposal_status": "provisional",
        "decision_outcome": "provisional",
        "decision_ref": "decisions/RUN-OFS003-PILOT-002/PRP-CTR-274867.json",
        "profile_age_days": 0,
        "field_evidence_complete": false,
        "accepted_current": false
      },
      {
        "center_id": "CENTER-RIKEN-IRDS",
        "profile_status": "provisional",
        "proposal_status": "provisional",
        "decision_outcome": "provisional",
        "decision_ref": "decisions/RUN-OFS003-PILOT-002/PRP-CTR-454136.json",
        "profile_age_days": 0,
        "field_evidence_complete": false,
        "accepted_current": false
      },
      {
        "center_id": "CENTER-RIKEN-RCCS",
        "profile_status": "provisional",
        "proposal_status": "provisional",
        "decision_outcome": "provisional",
        "decision_ref": "decisions/RUN-OFS003-PILOT-002/PRP-CTR-315182.json",
        "profile_age_days": 0,
        "field_evidence_complete": false,
        "accepted_current": false
      },
      {
        "center_id": "CENTER-SCIENCE-TOKYO-IIC",
        "profile_status": "provisional",
        "proposal_status": "provisional",
        "decision_outcome": "provisional",
        "decision_ref": "decisions/RUN-OFS003-PILOT-002/PRP-CTR-168261.json",
        "profile_age_days": 0,
        "field_evidence_complete": false,
        "accepted_current": false
      },
      {
        "center_id": "CENTER-TOHOKU-CSC",
        "profile_status": "provisional",
        "proposal_status": "provisional",
        "decision_outcome": "provisional",
        "decision_ref": "decisions/RUN-OFS003-PILOT-002/PRP-CTR-336834.json",
        "profile_age_days": 0,
        "field_evidence_complete": false,
        "accepted_current": false
      },
      {
        "center_id": "CENTER-TSUKUBA-CCS",
        "profile_status": "provisional",
        "proposal_status": "provisional",
        "decision_outcome": "provisional",
        "decision_ref": "decisions/RUN-OFS003-PILOT-002/PRP-CTR-931974.json",
        "profile_age_days": 0,
        "field_evidence_complete": false,
        "accepted_current": false
      },
      {
        "center_id": "CENTER-UTOKYO-ITC",
        "profile_status": "provisional",
        "proposal_status": "provisional",
        "decision_outcome": "provisional",
        "decision_ref": "decisions/RUN-OFS003-PILOT-002/PRP-CTR-200991.json",
        "profile_age_days": 0,
        "field_evidence_complete": false,
        "accepted_current": false
      }
    ]
  },
  "gaps": {
    "missing_profiles": [],
    "unexpected_profiles": [],
    "duplicate_profiles": [],
    "non_accepted_profiles": [
      {
        "center_id": "CENTER-AIST-IHF",
        "profile_status": "provisional",
        "decision_outcome": "provisional"
      },
      {
        "center_id": "CENTER-HOKKAIDO-IIC",
        "profile_status": "provisional",
        "decision_outcome": "provisional"
      },
      {
        "center_id": "CENTER-ISM-CSST",
        "profile_status": "provisional",
        "decision_outcome": "provisional"
      },
      {
        "center_id": "CENTER-JAMSTEC-CEIST",
        "profile_status": "provisional",
        "decision_outcome": "provisional"
      },
      {
        "center_id": "CENTER-JCAHPC",
        "profile_status": "provisional",
        "decision_outcome": "provisional"
      },
      {
        "center_id": "CENTER-KYOTO-ACCMS",
        "profile_status": "provisional",
        "decision_outcome": "provisional"
      },
      {
        "center_id": "CENTER-KYUSHU-RIIT",
        "profile_status": "provisional",
        "decision_outcome": "provisional"
      },
      {
        "center_id": "CENTER-NAGOYA-ITC",
        "profile_status": "provisional",
        "decision_outcome": "provisional"
      },
      {
        "center_id": "CENTER-OSAKA-D3",
        "profile_status": "provisional",
        "decision_outcome": "provisional"
      },
      {
        "center_id": "CENTER-RIKEN-IRDS",
        "profile_status": "provisional",
        "decision_outcome": "provisional"
      },
      {
        "center_id": "CENTER-RIKEN-RCCS",
        "profile_status": "provisional",
        "decision_outcome": "provisional"
      },
      {
        "center_id": "CENTER-SCIENCE-TOKYO-IIC",
        "profile_status": "provisional",
        "decision_outcome": "provisional"
      },
      {
        "center_id": "CENTER-TOHOKU-CSC",
        "profile_status": "provisional",
        "decision_outcome": "provisional"
      },
      {
        "center_id": "CENTER-TSUKUBA-CCS",
        "profile_status": "provisional",
        "decision_outcome": "provisional"
      },
      {
        "center_id": "CENTER-UTOKYO-ITC",
        "profile_status": "provisional",
        "decision_outcome": "provisional"
      }
    ],
    "stale_profiles": [],
    "field_gaps": [
      {
        "center_id": "CENTER-AIST-IHF",
        "missing_fields": [
          "users",
          "data_connectivity"
        ],
        "partial_fields": [
          "current_system",
          "power",
          "software",
          "operations",
          "migration"
        ],
        "stale_fields": []
      },
      {
        "center_id": "CENTER-HOKKAIDO-IIC",
        "missing_fields": [
          "power",
          "software"
        ],
        "partial_fields": [
          "users",
          "priority_domains",
          "refresh_window",
          "facility",
          "operations",
          "migration",
          "data_connectivity"
        ],
        "stale_fields": []
      },
      {
        "center_id": "CENTER-ISM-CSST",
        "missing_fields": [
          "refresh_window",
          "power",
          "facility",
          "software",
          "migration"
        ],
        "partial_fields": [
          "users",
          "data_connectivity"
        ],
        "stale_fields": []
      },
      {
        "center_id": "CENTER-JAMSTEC-CEIST",
        "missing_fields": [
          "facility"
        ],
        "partial_fields": [
          "users",
          "priority_domains",
          "power",
          "software",
          "migration",
          "data_connectivity"
        ],
        "stale_fields": []
      },
      {
        "center_id": "CENTER-JCAHPC",
        "missing_fields": [
          "priority_domains",
          "power",